title,abstract,date,department,type,url
Fysiotherapeutische analyse en conservatieve behandeling van een achterste kruisbandletsel van de knie: een casereport,"Achtergrond: Het herstel na conservatief behandeld achterste kruisbandletsel (PCL) verloopt niet eenduidig. Hoewel de PCL een relatief groot intrinsiek genezingsvermogen heeft, leidt structureel herstel niet vanzelfsprekend tot volledig functioneel herstel. Deze onzekerheid neemt toe bij aanwezigheid van bijkomende knie-gerelateerde comorbiditeiten, zoals kraakbeenschade, botoedeem, verhoogde gewrichtslaxiteit en overgewicht, die het herstel en de belastbaarheid van het kniegewricht kunnen beïnvloeden. Voor conservatieve PCL-revalidatie in combinatie met dergelijke factoren ontbreken specifieke Nederlandse fysiotherapeutische richtlijnen, waardoor onduidelijk is hoe herstel optimaal gemonitord moet worden.Doel: Het doel van deze casestudie was het beschrijven van veranderingen in subjectieve kniefunctie en statische en dynamische balans gedurende tien weken conservatieve fysiotherapeutische revalidatie bij een 26-jarige vrouw met een PCL-letsel en bijkomende knie-gerelateerde comorbiditeiten.Methode: Er werd een enkelvoudige, prospectieve casestudie uitgevoerd met een pre-post design en twee meetmomenten (baseline en week 10). Subjectieve kniefunctie werd gemeten met de International Knee Documentation Committee Subjective Knee Form (IKDC). Statische balans werd beoordeeld met de Single Leg Stance (SLS) en dynamische balans met de Y-Balance Test (YBT). Aanvullend werden de Step-down Test (SDT), de Medical Research Council-schaal (MRC) en de body mass index (BMI) gebruikt. De behandeling bestond uit een criterium-gebaseerd, conservatief fysiotherapeutisch programma gericht op actieve stabiliteit, neuromusculaire controle en geleidelijke belastingstoename.Resultaten: De IKDC-score verbeterde klinisch relevant van 52% bij baseline naar 76% na tien weken. De statische balans nam toe, met een duidelijke verlenging van de standduur tijdens de SLS aan de aangedane zijde. De dynamische balans liet verbeteringen zien in YBT-composietscore en asymmetrie, maar deze veranderingen bleven binnen de meetfout. De bewegingskwaliteit tijdens de SDT verbeterde, met verminderd knietrillen, afname van varusbeweging en minder pijn bij diepe knieflexie. Spierkracht bleef onveranderd en de BMI nam licht af.Conclusie: Tien weken conservatieve fysiotherapeutische revalidatie gingen gepaard met een duidelijke en klinisch relevante verbetering van de subjectieve kniefunctie en aanwijzingen voor verbetering van statische balans bij een patiënte met PCL-letsel en comorbiditeiten. Normalisatie van dynamische balans werd binnen deze periode niet bereikt. Dit onderstreept dat herstel na PCL-letsel een langdurig en criterium-gebaseerd proces is, waarbij interpretatie van uitkomstmaten met voorzichtigheid dient te gebeuren. Toekomstig onderzoek met grotere cohorten en langere follow-up is nodig om het herstelverloop na conservatieve PCL-revalidatie verder te onderbouwen.",,,,https://hbo-kennisbank.nl/details/sharekit_hu:oai:surfsharekit.nl:4a03e73f-8dec-4d10-a546-e52341c71056
Civiel centrum Oppidum Batavorum,"In deze scriptie zijn 144 metalen militaria uit de opgraving op de St. Josephhof geanalyseerd. De vondsten zijn ingedeeld in drie hoofdgroepen: wapentuig, gordelonderdelen en paardentuig. Het terrein van de huidige St. Josephhof maakte in de Romeinse tijd deel uit van Oppidum Batavorum, een proto-urbane nederzetting die rond 19 tot 16 of 12 v. Chr. werd gesticht en bleef bestaan tot haar vernietiging tijdens de Bataafse Opstand (69–70 n. Chr.).Het onderzoek is gebaseerd op materiaal uit vier onderzoeken (1950, 1981–1983, 2005–2006 en 2008) en begon met een studie van het fysieke materiaal in het Archeologisch Depot Nijmegen. De resultaten hiervan zijn vervolgens vastgelegd in de PAN-database (Portable Antiquities of the Netherlands). Alle vondsten zijn onderzocht op metaalsoort, decoratie, compleetheid, functie en, indien mogelijk, type. De gegevens zijn vervolgens geverifieerd door een materiaalspecialist.De meeste vondsten (62,4%) dateren uit 12 v. Chr. – 120 n. Chr., wat goed aansluit bij de bestaansperiode van Oppidum Batavorum. Een relatief groot aandeel van de vondsten (17,7%) heeft een brede datering die overlapt met een kortstondig militair kamp dat volgens literatuuronderzoek in 70–71 n. Chr. op de restanten van het vernietigde Oppidum Batavorum werd aangelegd. Hoewel historische bronnen en eerder onderzoek het bestaan van dit kamp vermelden, ontbreken directe aanwijzingen in het huidige materiaal. De brede datering maakt het onmogelijk de vondsten eenduidig aan dit kamp toe te schrijven, maar de samenstelling suggereert dat het gebied na de Bataafse Opstand niet volledig werd verlaten. Uit de periode 120–300 n. Chr. zijn negen militaire objecten aangetroffen, waarvan sommige mogelijk afkomstig zijn van de begraafplaats van Ulpia Noviomagus, andere van een kleine civiele nederzetting, wat wijst op blijvende Romeinse aanwezigheid of hergebruik in een civiele context. Uit de periode 300–450 n. Chr. zijn vijf vondsten afkomstig, mogelijk van het nabijgelegen castellum Valkhof.Op basis van de functionele verdeling van de vondsten blijkt dat 61,7% tot het paardentuig behoort, 27,7% tot gordelonderdelen en 10,6% tot wapentuig. Slechts 27% van de vondsten is gedecoreerd, waarbij de decoratie meestal bestaat uit eenvoudige vormen als profilering, groeven en uitsteeksels die al tijdens het gietproces zijn aangebracht. Omdat deze decoraties zijn meegegoten, zeggen ze weinig over de status van de eigenaar.Een klein aantal vondsten (zes artefacten) is versierd met kostbare technieken zoals niëllo-inleg, vertinning, glaspasta en zelfs een ingelegde edelsteen. Deze bewerkingen vergden meer arbeid, materialen en vakkennis en lijken daarmee statusverhogend te zijn geweest. Voorbeelden zijn....",,,,https://hbo-kennisbank.nl/details/saxion_scripties:594036ab-add9-42e3-8036-abadd952e32c
Comparative analysis of fingermark development on biodegradable and traditional plastic garbage bags,"The escalating plastic waste crisis has increased the need for sustainable alternatives. Biodegradable plastics have emerged as a promising solution and are now frequently encountered at crime scenes. Although many studies have been published on the development of fingermarks on conventional plastics, limited research has been conducted on them on bioplastics. Therefore, this study aimed to evaluate the efficiency of various fingermark development techniques on biodegradable (d2w) plastic garbage bags compared to traditional (Dumil) plastic garbage bags. Fingermarks were deposited on one of the two types of plastics and developed with one of the following methods: magnetic powder (MP), wet powder (WP), cyanoacrylate fuming (CAF) with Basic Yellow 40, or Vacuum Metal Deposition (VMD). After deposition, fingermarks were left to age for eight different time periods upon development, ranging from fresh (24 h) up to 50 days (about 1 and a half months). Results demonstrated that high-quality fingermarks could be obtained using wet powder and cyanoacrylate fuming, specifically on biodegradable plastics. The effectiveness of magnetic powder on both types of plastic declined over time, while vacuum metal deposition showed inconsistent results. Overall, in this study, fingermarks on biodegradable plastics exhibited more ridge detail than those on traditional plastics. The inability to achieve uniform zinc evaporation during vacuum metal deposition development may explain the differences in fingermark development between the plastic types. This research underscores the need for forensic methodologies for biodegradable plastics to ensure reliable evidence collection in criminal investigations. Further studies are essential to enhance fingermark development techniques for these emerging materials.",,,,https://hbo-kennisbank.nl/details/amsterdam_pure:oai:pure.hva.nl:publications%2F9633b76c-cd3e-43cc-bb65-95ec5a214e4b
The impact of lighting and indoor air quality conditions on students’ comfort and performance in higher education: a 2x2 factorial design approach,,,,,https://hbo-kennisbank.nl/details/hanze_pure_rest:78d4f199-bc10-4af3-820c-aeb907698fb9
Passie in de amateurkunst,Artikel over de rol van passie in de amateurkunst,,,,https://hbo-kennisbank.nl/details/hanzepure:oai:research.hanze.nl:publications%2F9d438551-5646-46de-9fc8-7c15f1270e9e
A legal overview on International & European Safety Standards for hydrogen applications,"Dit rapport is deel I van twee delen waarin de veiligheidsnormen worden onderzocht die van toepassing zijn op waterstoftoepassingen. In deel I wordt ingegaan op de vraag welke normen hoofdzakelijk van toepassing zijn op waterstoftankstations, brandstofcel technologieën en (kleine) waterstof opslag die relevant zijn voor de Nederlandse vergunningsprocedure en wat is de hierarchie tussen deze normen en formele Europese wetgeving. Deel II gaat in op de Nederlandse situatie en behandelt daarbij ook de open normen in het recht en de veiligheidsnormen.",,,,https://hbo-kennisbank.nl/details/hanzepure:oai:research.hanze.nl:publications%2Fe4708d79-de4d-49b0-8385-024bf408dc22
De Malpie,Het afstudeerproject bestaat uit twee onderdelen: enerzijds dit verantwoordingsdocument en anderzijds een eindproduct in de vorm van een 3D-model. Het project werd uitgevoerd in opdracht van de Omgevingsdienst Zuidoost-Brabant (ODZOB) en vond plaats in twee periodes: tussen 2 februari 2025 en 3 juli 2025 en van 1 september 2025 en 15 januari 2026. Het doel van het verantwoordingsdocument is “het archeologisch verantwoord reconstrueren van een 3D-model van het historische landschap van de Malpie in 1648”.,,,,https://hbo-kennisbank.nl/details/saxion_scripties:2605dcb4-2948-4ee8-85dc-b42948cee891
Functionele materialen en meetinstrumenten voor AHF-diagnostiek en -training in kleinschalige verpleeghuizen.,"InleidingAfname van arm-handfi.mctie (AHF) hangt samen met een verminderd vermogen om algemene dagelijkse levensverrichtingen (ADL) zelfstandig uit te voeren (McGrath et al., 2018). In de kleinschalige verpleeghuizen van Zonnehuisgroep Noord varieert het aanbod en de kwaliteit van AHF-trainingen, mede door beperkte materialen en meetinstmmenten, waardoor een consistente AHF-behandeling ontbreekt. Dit onderzoek biedt inzicht in een praktisch en evidence-based aanbeveling van materialen en meetinstmmenten voor AHF- diagnostiek en -training.MethodeHet ontwerpgerichte onderzoek volgde het Double Diamond-model, met de fasen: verkennen, definiëren, ontwikkelen en opleveren. In een probleem-verkennend gesprek met de betrokken ergotherapeut van Zonnehuisgroep Noord werden knelpunten en behoeften in kaart gebracht, waamit ontwerpcriteria werden geformuleerd. Vervolgens werd literatuuronderzoek gedaan naar geschikte meetinstmmenten en trainingsvormen. Het ontwikkelde concept werd door de ergotherapeut beoordeeld op toepasbaarheid.ResultatenDe Stroke Upper Limb Capacity Scale (SULCS) bleek het meest geschikt voor AHFdiagnostiek vanwege de betrouwbaarheid, korte afnametijd en brede toepasbaarheid. Voor AHF-training kwam ADL-geïntegreerde training naar voren, gericht op functioneel behoud door integratie in dagelijkse activiteiten. De ergotherapeut beoordeelde beide  concepten als uitvoerbaar, praktisch en haalbaar binnen de dagelijkse zorgcontext.DiscussieHoewel de resultaten aansluiten bij de ontwerpcriteria, beperken de betrokkenheid van één ergotherapeut en het ontbreken van praktijktoetsing de generaliseerbaarheid. Vervolgonderzoek is wenselijk om implementatie en effectiviteit in de praktijk te evalueren.ConclusieHet onderzoek biedt een praktische en evidence-based aanbeveling waarmee ergotherapeuten AHF bitmen kleinschalige vetpleeghuizen effectief kunnen diagnosticeren len trainen.Met samenvatting in het nederlands. Includes a summary in English.",,,,https://hbo-kennisbank.nl/details/sharekit_hhs:oai:surfsharekit.nl:d4fbc11f-a7eb-453c-9873-cad972021cf3
Symposium “Infrastructuur als structurerende kracht in de verbouwing van Nederland”,"Op dit symposium worden onderzoekers, beleidsmakers en praktijkdeskundigen samen gebracht om te verkennen hoe wetenschap, beleid en uitvoering elkaar kunnen versterken bij vraagstukken in relatie tot de grootschalige vernieuwingsopgave, klimaatadaptie, natuurherstel, energietransitie en demografische ontwikkelingen.",,,,https://hbo-kennisbank.nl/details/hanze_pure_rest:2207884e-69d5-408e-adf2-1e166198c5a6
Arbeidsmarktscan ICT-beroepen Regio Zwolle,"De Arbeidsmarktscan ICT-beroepen van Digital District Zwolle (DDZ) biedt een integraal, fact-based overzicht van de ICT-arbeidsmarkt in de Regio Zwolle om de structurele arbeidskrapte en digitale uitdagingen aan te pakken. Door data van bronnen zoals het CBS, UWV en DUO te combineren, geeft het rapport diepgaand inzicht in de regionale werkgelegenheid, vacaturemarkt en de ontwikkeling van ICT-talent. De scan dient als strategisch instrument voor overheid, onderwijs en bedrijfsleven om gezamenlijk beslissingen te nemen die de regionale digitale economie versterken en ICT-professionals optimaal benutten en behouden voor de regio.Gerealiseerd in opdracht van Digital District Zwolle",,,,https://hbo-kennisbank.nl/details/sharekit_windesheim:oai:surfsharekit.nl:30c1b9ba-f469-4956-a9d3-40476b4720c8
More and More and More,"Book review of J.B. Fressoz (2024). More and More and More. An All-Consuming History of Energy, Penguin Random House, 400 pp. First published on: https://vbds.nl/2025/11/01/more-and-more-and-more/. A Dutch version of this review has been added. This translation is also published on: https://vbds.nl/wp-content/uploads/2025/11/Meer-en-Meer-en-Meer.pdf.",,,,https://hbo-kennisbank.nl/details/amsterdam_pure:oai:pure.hva.nl:publications%2F8f8ce6f5-2b5c-43b1-ba16-f02ee11633e0
Regio Zwolle Monitor 2025,"De Regio Zwolle Monitor brengt jaarlijks het reilen en zeilen van Regio Zwolle in beeld aan de hand van statistieken en cijfers. Het signaleert trends en ontwikkelingen en geeft een indruk van de ontwikkelkracht van de regio. Daarmee is de Regio Zwolle Monitor voor de Economic Board Regio Zwolle een belangrijke bron van informatie om te bepalen op welk terrein de (economische) koers van de regio bijgestuurd kan of moet worden. Deze monitor biedt een rijk en feitelijk onderbouwd beeld van hoe de regio ervoor staat toegespitst op vier thema’s: brede welvaart, economisch verdienvermogen, inclusieve samenleving en duurzame leefomgeving.",,,,https://hbo-kennisbank.nl/details/sharekit_windesheim:oai:surfsharekit.nl:a7503560-6434-4569-925b-60b80020a887
A Dyadic Analysis of Interprofessional Collaboration in ECEC,"In child centers, professionals from childcare, education, and occasionally family support services participate in interprofessional collaboration (IPC) to facilitate smooth transitions from childcare to primary education, coordination between school and out-of-school care, provide care for children with special needs, and implement integrated services policies at center level. This study employed a multilevel model for dyadic networks to examine a national sample of professional networks of 788 professionals from 46 Dutch child centers. A newly developed instrument for assessing the degree of integration at center level (Index for Child Center Integration, ICCI) was associated with (inter)professional collaboration at dyadic level for childcare-to-school transitions, out-of-school care to school transition, care for children with special needs, and policy at center level. Higher levels of service integration at center level were associated with increased interprofessional collaboration.",,,,https://hbo-kennisbank.nl/details/amsterdam_pure:oai:pure.hva.nl:publications%2Fe2d8bf56-5f62-4772-98b1-a08dad784ab0
Exploring the effects of solar panel shading on the productivity and quality of forage production,"Deze scriptie onderzoekt hoe schaduw van vaste zonnepanelen de productiviteit en kwaliteit van een perennial-ryegrass/white-clover grasland beïnvloedt. Op een proefperceel van Massey University (Palmerston North, Nieuw-Zeeland) werden vier zones vergeleken: onder de panelen, tussen panelen, aan de uiteinden en een open controle. Gedurende vier groeicycli werden lichtonderschepping, NDVI, droge-stofopbrengst en voederkwaliteits­parameters (ruw eiwit, ADF, NDF) gemeten. Schaduw verminderde het licht en de voorjaarsopbrengst, maar de zomerproductie en de voederwaarde bleven grotendeels behouden; onder-paneelpercelen vertoonden wel een iets hoger vezelgehalte. De resultaten tonen dat agrivoltaïsche systemen het graslandbeheer vereisen aan te passen (o.a. maai-/begrazingsmoment en paneelafstand) om opbrengstverliezen te beperken en dubbel grondgebruik mogelijk te maken.",,,,https://hbo-kennisbank.nl/details/aereshogeschool:oai:www.greeni.nl:VBS:2:153824
From Conceptual Ambiguity to Critical Engagement: AI Literacy as Artistic Research,"This presentation explores AI literacy as a critical and situated dimension of Artistic Research (AR), drawing from recent investigation conducted with Master’s students in a discursive artistic AI course at Frank Mohr Institute. Using a structured questionnaire as both a pedagogical and research tool, the study uncovers how emerging artists conceptualise, use, and imagine artificial intelligence—revealing tensions between speculative expectations and grounded practices. The paper is expanded through a reflection in dialogue with selected students, and an artistic analysis of works they developed and the author curated for the 2024 symposium Encounters in Artistic Research. This triangulated methodology allows for a nuanced view of how literacy, practice, and critique co-evolve across time and context. The findings reveal striking conceptual ambiguities: definitions of AI among participants range from technical (algorithmic/machine learning) to metaphorical, critical, and even anthropomorphic. While AI is present in students’ daily lives, it remains marginal within their artistic practices. Nevertheless, their imagined futures for AI—emotional support, creative co-authorship, abstract thinking, political disruption—exceed their current capabilities and signal a strong desire for meaningful integration. By positioning AI literacy not merely as tool-based training but as a form of epistemological inquiry, this paper proposes a reframing of Human-Centred AI (HCAI) in artistic practice. The artist is not only a user or co-creator but an interpreter of algorithmic systems, capable of transforming technological opacity into critical reflection. This resonates with the evolving landscape of AR, where methodologies bridge creative speculation with pedagogical, social, and technological critique. The paper will conclude by proposing initial parameters for a literacy-driven, participatory methodology in artistic AI research. It will reflect on how such frameworks can contribute to institutional knowledge while resisting premature normalization of AI tools. Inviting a broader discussion on authorship, algorithmic imaginaries, and the role of artistic research in shaping inclusive and reflexive AI futures.",,,,https://hbo-kennisbank.nl/details/hanze_pure_rest:23e29353-b50a-48df-8de0-072333de086b
Citizen Science Expo,"Fish bowl sessie Ethiek in participatief actieonderzoek, vanuit  SPRONG-consortium Bridge 2 Health",,,,https://hbo-kennisbank.nl/details/hanze_pure_rest:87386d97-e95b-47bb-97aa-443b9acc060c
Soenveld_dewit_19122025_essayrobotrechten_nederlandsjuristenblad,"Met toestemming vqn de uitgever overgenomen uit: Nederlands Juristenblad, 19-12-2025, nr. 40          Artikel in nederlands juristenblad over robotrechten",,,,https://hbo-kennisbank.nl/details/saxion_kenniscentra:79404d95-209d-44a5-804d-95209da4a599
Cost-effectiveness of multidisciplinary transitional care interventions,"Background: Multidisciplinary transitional care interventions promote care coordination after hospital discharge and address (older) patients' complex care needs related to their physical, nutritional, and/or psychosocial status.  Objective: This review aimed to identify, critically appraise, and synthesize evidence on the cost-effectiveness of multidisciplinary transitional care interventions compared to usual care.  Design: Systematic review and meta-analysis.  Setting(s): Hospitals and primary care.  Participants: Adult patients admitted to a hospital, regardless of their condition, and discharged home.  Methods: Medline, Embase, CINAHL, and CENTRAL were searched for randomized controlled trials assessing multidisciplinary transitional care interventions' cost-effectiveness compared to usual care and reporting quality of life or quality-adjusted life years (QALY) from inception to July 2024. Findings were stratified by economic perspective and follow-up duration. Evidence certainty was assessed using Grading of Recommendations Assessment, Development, and Evaluation. The primary outcome was the incremental net monetary benefit (expressed as mean difference). Cost-effectiveness acceptability curves depicted probabilities of cost-effectiveness at various willingness-to-pay thresholds.  Results: Thirteen trials, containing 4114 patients, were included. From a healthcare perspective over 12 months, there was “low” certainty that multidisciplinary transitional care interventions reduced healthcare costs (MD, €-3452; 95 % CI, − 8816 to 1912) while there was no difference in QALYs (MD, 0.00; 95 % CI, − 0.03 to 0.04) compared to usual care. The probability of cost-effectiveness over 12 months was 90 % at a willingness-to-pay of €0/QALY, decreasing slightly to 84 % at higher willingness-to-pay thresholds (“moderate” certainty). Over six months, cost-effectiveness probabilities ranged from 43 % at €0/QALY to 87 % at €100,000/QALY, exceeding 80 % at a willingness to pay of €50,000/QALY (“low” to “moderate” certainty). From a societal perspective, the probabilities of cost-effectiveness were lower, primarily due to a limited number of studies with conflicting results.  Conclusions: Multidisciplinary transitional care interventions demonstrate potential for cost-effectiveness. However, the “low” evidence certainty of most comparisons underscores the need for further research to explore the cost-effectiveness of different types of multidisciplinary transitional care interventions across patient populations and country income levels to identify the most cost-effective strategies.  Registration: The review protocol was registered on PROSPERO, CRD42023421423.",,,,https://hbo-kennisbank.nl/details/amsterdam_pure:oai:pure.hva.nl:publications%2F791dda21-d068-47c5-b877-ab01c2ede420
Wijkscan gezonde leefomgeving,"Sinds de bouw in de jaren '70 is Almere uitgegroeid tot de nummer 8 grootste stad van Nederland en wordt gekenmerkt door de meerdere kernen, veel groen, bijzondere bouwwerken en architectuur, veel water in en om de stad en hetuitgebreide netwerk van paden en wegen. De eerste bewoners wonen inmiddels zo'n 50 jaar in Almere, waardoor vergrijzing is toegeslagen in de oudste stadsdelen van Almere, vooral in Almere Haven. Het doel van dit project is het identificeren en prioriteren van wensen en behoeften van ouderen voor betere facilitering van bewegen en ontmoeten in de openbare ruimte in de wijken De Marken en De Hoven in Almere Haven.",,,,https://hbo-kennisbank.nl/details/aereshogeschool:oai:www.greeni.nl:VBS:2:153975
What is the effect of myofascial release and pain neuroscience education on disability in adults with chronic nonspecific low back pain?,"Chronic nonspecific low back pain (CNSLBP) is a major problem and a leading cause of years lived with disability worldwide, with its burden expected to increase further. Disability represents a particularly important outcome in CNSLBP, as it is more strongly associated with reduced quality of life, work loss, and increased healthcare and societal cost than pain intensity alone. Contemporary physiotherapy management therefore emphasizes interventions addressing both physical and psychosocial contributors to disability. Among these, myofascial release (MFR) and pain neuroscience education (PNE) are widely used, yet their relative effects on disability remain unclear. The purpose of this literature review to evaluate the effects of MFR and PNE on disability in adults with CNSLBP.Conclusion: Both myofascial release and pain neuroscience education are associated with significant reductions in disability in adults with chronic nonspecific low back pain. However, due to heterogeneity of interventions and the absence of direct comparisons, no conclusion can be drawn regarding the superiority of one intervention over the other. Based on these findings, both MFR and PNE may be considered as part of a multimodal physiotherapy approach aimed at reducing disability in patients with CNSLBP. Future research should focus on well-conducted randomized controlled trials directly comparing MFR and PNE using standardized intervention protocols and consistent reporting of clinically relevant disability outcomes.",,,,https://hbo-kennisbank.nl/details/sharekit_hhs:oai:surfsharekit.nl:47995a17-bad6-4f87-853a-34226fa3cf7b
A4: Isala on EHR: openEHR for secondary data use in radiotherapy.,,,,,https://hbo-kennisbank.nl/details/hanzepure:oai:research.hanze.nl:publications%2F38e682ef-5bcd-4429-a6be-f2e0af214c59
