title,abstract,date,department,type,url
Nieuwkomers in de sociale basis in Amsterdam,"Dit boekje gaat over het tweede deel van het onderzoek van Lectoraat Stedelijk Sociaal Werk naar de opvang van nieuwkomers in de sociale basis. De centrale vraag is: Wat is de ervaring van opbouwwerkers in de sociale basis met de opvang van nieuwkomers? Wat is belangrijk voor het bereiken en goed opvangen van nieuwkomers, en welke uitdagingen zijn er? Welzijnsorganisaties lijken meestal geen specifiek beleid te maken voor de ondersteuning van nieuwkomers, dit in navolging van het bredere beleid waarbij de sociale basis gericht is op alle Amsterdammers. In het eerste deel van dit onderzoek (Aankomen in Amsterdam) bleek echter dat verschillende nieuwkomers zonder extra inzet de weg naar voorziening in de sociale basis niet vinden. Er is nog weinig onderzoek naar de specifiek ervaring van opbouwwerkers met de opvang van nieuwkomers. Daarom stellen we de opbouwwerker hier centraal. Deze publicatie geeft inzicht in de rol van de opbouwwerker en de manier waarop zij samenwerken met verschillende partijen in de aankomstinfrastructuur en sociale infrastructuur.",,,,https://hbo-kennisbank.nl/details/amsterdam_pure:oai:pure.hva.nl:publications%2F83cd2437-8789-4acc-be6f-c93a43c3ddb2
"Feasibility, reliability, and clinical utility of skeletal muscle assessment with A-mode ultrasonography in hospitalized patients with burns",,,,,https://hbo-kennisbank.nl/details/hanzepure:oai:research.hanze.nl:publications%2Fcda492cb-5de9-41e5-a2e1-0a763c2a978d
Offeren en liefhebben,"Offeren is geen populair onderwerp. Snel komen associaties op met masochisme, zelfverachting en een morbide antipathie tegen een goed leven. Toch wordt er, ook in onze samenleving, heel wat geofferd. Voor kinderen, partners en ouders. Met het oog op gezondheid, sportprestaties en statusjacht. Religieus bezien gaat het offer ook door; heel concreet in eucharistie of avondmaal, maar ook in navolging, het geven van gaven, vormen van toew­ijding, vasten.Dit nieuwe Verantwoording Essay verkent het offer als fenomeen: Wat doen we als we een offer brengen? Wat zegt het over onszelf, onze verhouding tot de werkel­ijkheid, tot de ander en tot God?Een zoektocht naar nieuwe taal om op een gezonde, gegronde én gelovige manier te praten over offeren.",,,,https://hbo-kennisbank.nl/details/sharekit_che:oai:surfsharekit.nl:769a78e4-97d4-4180-84ca-f5be6595485c
Conference presentation: Generation Z Leadership for Sustainability Transitions,A comparative exploration of leadership expectations in the Netherlands and South Africa examining what leadership behaviors Generation Z perceives as most supportive for driving sustainability transitions and institutional resilience.,,,,https://hbo-kennisbank.nl/details/sharekit_inholland:oai:surfsharekit.nl:1b272ae2-f06a-44bb-8554-0599bd9762ba
Waar transities tastbaar worden,"Binnen het project Verbeelding in Transities ontwikkelden Werk, Participatie en Inkomen (WPI) van de gemeente Amsterdam en vier hogescholen samen een reeks creatieve gespreksvormen. Maar hoe verhouden zulke tastbare gespreksvormen zich tot de abstracte begrippen ‘verbeelding’ en ‘transitie’ binnen het werk van WPI? Deze terugblik gaat in op de aanleiding voor dit initiatief én het proces waarin de samenwerking tot stand kwam. Daarnaast worden enkele begrippen in kaders toegelicht.",,,,https://hbo-kennisbank.nl/details/amsterdam_pure:oai:pure.hva.nl:publications%2F6589c33f-a10b-42de-a97b-d680f242991d
Hergebruik Infrastructuurmaterialen,"Gemeenten staan voor de uitdaging om bij het onderhoud, de herinrichting en de nieuwbouw van straten circulair en toekomstbestendig te werken. Steeds vaker ontwikkelen zij duurzaamheidsrapportages om hun prestaties op dit gebied te meten en hierover verantwoording af te leggen. Door circulariteit toe te passen kan slimmer worden omgegaan met materialen, kunnen de levenscycli van producten en constructies worden verlengd en wordt afval en CO₂-uitstoot zoveel mogelijk beperkt.Met dit onderzoek willen we met een praktisch rekenmodel gemeenten ondersteunen bij het inzichtelijk maken van de circulaire mogelijkheden van hergebruik.Voor dit onderzoek zijn drie modellen ontwikkeld: een CO2-module, een TCO-module (Total Cost of Ownership) en een kosten- en hergebruikwaardemodule. De CO2-module geeft het verschil in CO2-uitsoot weer tussen nieuw en herbruikbare straatstenen. De TCO-module laat de totale eigendomskosten zien van nieuwe en herbruikbare straatstenen. De kosten van gehele levensduur worden hierdoor inzichtelijk. De kosten- en hergebruikwaardemodule toont hoeveel kosten worden bespaard door oude materialen te gebruiken.Hergebruik leidt in dit rekenmodel altijd tot minder CO2-uitstoot. Onder bepaalde voorwaarden is hergebruik van infrastuctuurmaterialen ook voordeliger dan gebruik nieuwe materialen.",,,,https://hbo-kennisbank.nl/details/sharekit_inholland:oai:surfsharekit.nl:49fb5e91-42ee-409f-8617-6eb5ad243aec
Stikstofuitspoeling in voedselbossen,"In Nederland is er een overmaat aan stikstof, o.a. veroorzaakt door bemesting in de intensieve landbouw. Overtollige stikstof uit mest en kunstmest spoelt uit naar grond- en oppervlaktewate, waar het eutrofiëring veroorzaakt en ecosystemen aantast. Voedselbossen zijn een alternatieve vorm van landbouw die mogelijk kan bijdragen aan het verminderen van stikstofuitspoeling in de bodem, omdat er geen bemesting plaatsvindt. De huidige mate van stikstofuitspoeling is onderzocht in twee voedselbossen (Den Food Bosch en Nieuw Annaland), een akker en een volwassen bos met behulp van resin bags: zakjes met resin die in staat zijn ionen uit een oplossing aan te trekken en uit te wisselen (bijv. stikstof). De resin bags werden gedurende periodes van 3 en 5 weken in de bodem geplaatst op 30, 60 en 90 centimeter diepte. De hypothese was dat de stikstofuitspoeling het hoogst zou zijn op de akker, gevolgd door de voedselbossen, en het laagst in het bos.Uit de resultaten bleek dat de akker significant meer stikstofuitspoeling heeft in de bovenste laag (30 cm) dan Den Food Bosch en het bosperceel (p < 0,05). Op de onderste laag (90 cm) is bij Nieuw Annaland een significant verschil gevonden ten opzichte van het bosperceel (p < 0,05). Dit kan mogelijk worden verklaard door een stijging in de grondwaterstand waardoor de resin bags sneller stikstof hebben opgenomen. In vervolgonderzoeken zouden meer meetpunten kunnen helpen met het in kaart brengen van een geheel voedselbos om de stikstofdynamiek beter weer te kunnen geven.",,,,https://hbo-kennisbank.nl/details/has:oai:www.greeni.nl:VBS:2:153849
Ergotherapie im Reha-Alltag,"Die medizinische Rehabilitation steht vor der Herausforderung, therapeutische Inhalte wirksam in den Alltag der Rehabilitand:innen zu übertragen. Als zentrale Profession arbeitet die Ergotherapie betätigungszentriert und kontextbezogen. Da bislang unklar ist, wie stationäre Rahmenbedingungen diese Praxis beeinflussen, untersucht die Bachelorarbeit, wie Ergotherapeut:innen den Einfluss des stationären Kontextes auf betätigungszentrierte Interventionen erleben.",,,,https://hbo-kennisbank.nl/details/sharekit_zuyd:oai:surfsharekit.nl:578a5b21-f7fd-4118-a1ca-b9807671cd10
Reduceren en verschuiven van warmtevraag  binnen netcapaciteitsgrenzen,"Het Nederlandse elektriciteitsnet staat onder druk door netcongestie. Hierdoor krijgen nieuwbouw- en herontwikkelingsprojecten steeds vaker een beperkte transportcapaciteit toegewezen. In de onderzochte casestudy (transporthub Berkel en Rodenrijs) bedraagt de beschikbare netcapaciteit overdag 55 kW (06:00–23:00), terwijl de verwachte piekbelasting 101 kW is. Om binnen deze beschikbare netcapaciteit te kunnen functioneren is in het huidige ontwerp een batterij van 800 kWh toegepast. Bij een emissiefactor van 74 kg CO₂-eq per kWh batterijcapaciteit zorgt dit voor ongeveer 59.200 CO₂-uitstoot. Over een gebouwlevensduur van 50 jaar (met vervanging van batterijen) komt dit neer op 177,6 ton CO₂.Dit onderzoek bepaalt welke combinatie van operationele sturing en bouwkundige/technische maatregelen de elektrische last van verwarmings- en koelinstallaties het meest effectief verlaagt of verschuift, met als doel de benodigde batterijcapaciteit en CO₂-impact te verminderen. De aanpak bestaat uit een ja/nee-selectie om te bepalen welke varianten uitgewerkt worden, een analyse van het verwachte belastingprofiel, gebouwsimulaties in VABI Elements om warmtevraag en warmteverliezen te bepalen en varianten in de thermische schil te beoordelen, Excel-berekeningen voor batterij- en warmteopslagdimensionering en CO₂-berekeningen (materialen en installaties) en een multicriteria-analyse (MCA) voor integrale vergelijking van varianten. Uit de simulatie volgt een warmteverlies van 105 kW, met transmissieverliezen naar buiten (47%) en infiltratie (30%) als dominante componenten. Op een maatgevende winterdag is de totale warmtevraag 2.227 kWh, waarvan 1.560 kWh tussen 06:00 en 23:00 uur. Voor vraagvermindering blijken vooral dakisolatie (Rc 9,0) en volledig gesloten overheaddeuren (80 mm) effectief (≈5% warmtevraagreductie per maatregel). Voor lastverschuiving is korte-termijn warmteopslag in water de meest evenwichtige optie: PCM heeft een kleiner volume nodig, maar heeft hoge materiaalgebonden CO₂-uitstoot. Zand, rots en heatcrete vragen te veel ruimte. De integrale beoordeling laat zien dat de beste oplossing bestaat uit wateropslag met nachtelijke warmtepompsturing, gecombineerd met gerichte schilverbeteringen (dak Rc 9,0 en gesloten overheaddeuren 80 mm). Dit scenario behaalt de hoogste MCA-score en leidt tot een substantiële reductie van de benodigde batterijcapaciteit (halvering) met een netto CO₂-vermindering van 20 ton over de beschouwde levensduur, afhankelijk van gehanteerde aannames en emissiefactoren.",,,,https://hbo-kennisbank.nl/details/sharekit_hh:oai:surfsharekit.nl:11e12ca9-169c-4379-a9e1-411960dc6263
EEN AUTOBIOGRAFISCH ONDERZOEK IK?,"Ik?Ikke ikke ikke en de rest kan stikken? Dat terwijlwij mensen niet zonder elkaar kunnen bestaan.Waarom zijn we zo bezig met een unieke identiteitterwijl we veel meer op elkaar lijken dan onseigenlijk lief is? De mens is een kudde dier toch? Iser wel een IK zonder jou? Hoe kan ik eenauthentieke Ik zijn met jou? De zoektocht naaridentiteit en de invloed van anderen op die van mijwil ik hier onderzoeken. Wie hebben mij gevormd?Hoe ben ik of word ik een authentieke ik, ondanksmijn gebrek aan bewuste keuzes?",,,,https://hbo-kennisbank.nl/details/sharekit_fontys:oai:surfsharekit.nl:cd7aef1a-fbde-475a-a6a8-66d45bd7a13f
Motorische stoornissen bij dementie,"Dementie, met als voornaamste oorzaak de ziekte van Alzheimer, wordt in het algemeen vooral gezien als een ziekte waarbij cognitieve problemen optreden. Dat er ook al in een vroeg stadium motorische stoornissen optreden is veel minder bekend. In deze lezing wordt ingegaan op de motorische problemen bij dementie en paratonie in het bijzonder.",,,,https://hbo-kennisbank.nl/details/hanze_pure_rest:f341bc10-7e24-43ec-b1b2-0ca886692182
Development and testing of a predictive model of symptoms for pain in community-dwelling frail older people in palliative care,"BACKGROUND: Pain assessment is a necessary step in pain management in older people in palliative care. In older people, pain assessment can be challenging due to underreporting and atypical pain manifestations by other distressing symptoms. Anxiety, fatigue, loss of appetite, nausea, insomnia, dyspnoea, and bowel problems correlate with pain in palliative care patients. Insight into these symptoms as predictors may help to identify the underlying presence of pain. This study aimed to develop and test a prediction model for pain in community-dwelling frail older people in palliative care. METHODS: In this cross-sectional observational study, community-care nurses from multiple organizations across the Netherlands included eligible patients (life expectancy",,,,https://hbo-kennisbank.nl/details/hanzepure:oai:research.hanze.nl:publications%2F59e7cc57-c6f6-48af-986f-6c88476262f0
Contextual DNA samples in evaluations given activity level propositions,"Recent years have shown a growing effort in the evaluation of DNA given activity level propositions. Yet, its implementation remains challenging for forensic scientists due to the complexity of assessing relevant DNA TPPR mechanisms. One particular challenge is the sparsity of relevant experimental data in general and their applicability in the context of the case at hand. This difficulty is most apparent when considering the presence and quantity of prevalent and background DNA as the variables affecting them are highly specific and case-dependent, complicating their assessment based on literature data alone. It would hence be advantageous to assess prevalent and background DNA using information specific to the case, ideally gathered at the crime scene. We introduce the concept of contextual sampling: the targeted collection of additional samples from the surroundings of crime-related items to assign probabilities on prevalence and background based on case-relevant data. We identify several categories of contextual samples and demonstrate how these can inform sampling strategies and be integrated into Bayesian networks. Our findings show how contextual sampling allows for case-specific probability assignment, thereby reducing dependence on less-representative literature data. We also address practical considerations – including sample number, sampling location, and analytical strategy – and discuss limitations such as resource demands and uncertainties tied to small sample sizes. We conclude that contextual samples can be collected in anticipation of relevant alternative scenarios. This will provide forensic scientists with a valuable tool for casework, offering more nuanced and case-specific evaluations given activity level propositions. Further research could address operational protocols to optimize its implementation in forensic practice.",,,,https://hbo-kennisbank.nl/details/amsterdam_pure:oai:pure.hva.nl:publications%2F73372d1b-5cdc-4415-b018-c7ed6855eb0a
SUMAC-NL,Onderzoek en gebruik van de SUMAC. Presentatie voor Geriatrie netwerk Friesland,,,,https://hbo-kennisbank.nl/details/hanze_pure_rest:82932bda-e269-468a-8ce1-01d6449b84ec
Column: Zonnepanelen maken een distributiecentrum nog niet duurzaam,"Dat steeds meer distributiecentra worden uitgerust met zonnepanelen is een goede ontwikkeling, maar het maakt de keten nog niet duurzaam. De cruciale vraag is: welke rol vervult het distributiecentrum in de toekomstige foodketen? En welke energie, ruimte, data en arbeidskrachten zijn daarvoor nodig?",,,,https://hbo-kennisbank.nl/details/amsterdam_pure:oai:pure.hva.nl:publications%2F1eed4367-76b0-4a8d-885e-bfced5e32601
Ontwerpaspecten voor gezonde revalidatie,"Met veel plezier presenteer ik dit afstudeeronderzoek, uitgevoerd in het vierde jaar van mijn opleidingBouwkunde aan Hogeschool Inholland in Haarlem.Het onderzoek is mede mogelijk gemaakt dankzij de samenwerking met Marije Holstege, hoofdonderzoekerGRZPLUS en bijzonder lector geriatrische revalidatie bij Inholland. Dankzij haar betrokkenheid en desamenwerking met de zorginstelling de Omring kreeg ik toegang tot drie locaties, waar ik praktijkgerichtonderzoek kon doen. Eén van die locaties was Den Koogh, waar mijn opa ook heeft gezeten als begeleidwonende. Dit maakte het onderzoek voor mij extra bijzonder en persoonlijk.Daarnaast wil ik mijn dank uitspreken aan mijn begeleiders Elke Miedema en Miriam Uitterhoeve voorhun betrokkenheid, heldere feedback en begeleiding gedurende het proces.Tot slot wil ik iedereen bedanken die op welke manier dan ook heeft meegewerkt of meegedacht.Ik hoop dat u als lezer niet alleen inzicht haalt uit dit rapport, maar ook inspiratie opdoet voor hoe degebouwde omgeving kan bijdragen aan herstel en welzijn in de revalidatiezorg.",,,,https://hbo-kennisbank.nl/details/sharekit_inholland:oai:surfsharekit.nl:553bfa56-6a18-43ad-a2a8-2923156276bb
Rome in Blokken,"Voor dit onderzoek is een reconstructie van een deel van Rome gemaakt in Minecraft, waarin tien interactieve missies en minigames zijn toegevoegd. De gereconstrueerde gebouwen zijn vervolgens opgenomen in een catalogus. Daarnaast is er een verantwoordingsdocument opgesteld waarin de keuzes en stappen van het onderzoeksproces worden toegelicht.Het gereconstrueerde gebied betreft het politieke, culturele en religieuze hart van de stad, gesitueerd in het jaar 361 n.Chr. Ook zijn er woonwijken gereconstrueerd met Romeinse insulae (Romeinse appartementsgebouwen). Deze gebieden zijn opgedeeld in zeven sectoren: het Forum Romanum, de Keizerlijke Fora, de Palatijn, de Capitolijnse heuvel, de Via Sacra, de entertainmentgebouwen en de insulae.Dit onderzoek is uitgevoerd in opdracht van de VALUE Foundation en het Rijksmuseum van Oudheden. De reconstructie is uitgevoerd op een schaal van 1:1 en bevat tien interactieve elementen. De primaire doelgroep voor zowel de reconstructie als de interactieve missies bestaat uit jongeren tussen de 10 en 18 jaar.Het wetenschappelijke doel van dit onderzoek is het opstellen van een catalogus waarin zowel de reconstructies als het reconstructieproces helder worden vastgelegd, met als einddoel een beter begrip van het oude Rome te verkrijgen via een virtuele omgeving. Het maatschappelijke doel is om jongeren een duidelijker beeld te geven van het leven in het oude Rome, met nadruk op het dagelijks leven van een gewone Romeinse burger. Daarom zijn ook woonwijken gereconstrueerd en lopen er burger-NPC’s (non-playable characters) rond in de virtuele stad.De hoofdvraag van het onderzoek luidt: Hoe kan een interactieve reconstructie van Rome in 361 n.Chr. in Minecraft het beste worden weergegeven?De belangrijkste bevinding is dat Minecraft zich uitstekend leent als educatief middel, zeker wanneer het wordt gecombineerd met interactieve elementen. Dit gamificeert het leerproces, waardoor spelers op een toegankelijke en speelse manier kennis opdoen over het verleden.Zowel de technische als inhoudelijke integratie van de reconstructie bleek goed uitvoerbaar. Hoewel er soms concessies moesten worden gedaan om een balans te vinden tussen historische nauwkeurigheid en toegankelijkheid, is dit proces succesvol verlopen.Ik ben erg tevreden met het eindresultaat van deze reconstructie en ben ervan overtuigd dat deze aanpak ook toepasbaar is op andere steden en gebieden. Voor zover bekend is dit de eerste volledig interactieve Minecraft-reconstructie van Rome die ook wetenschappelijk verantwoord is vastgelegdDe reconstructie is te bekijken in de volgende video:https://www.youtube.com/watch?v=Pj8cgOTn1ic",,,,https://hbo-kennisbank.nl/details/saxion_scripties:29503f26-4a79-4520-8d50-ed17b8f61075
Op ieder potje past een deksel?,"In het werkveld wordt de dekselgeul van een kogelpot gebruikt als dateermiddel, maar waar zijn de deksels die tot ditfenomeen behoren? Van gelijktijdige bakselsoorten zijn deksels bekend, zoals Pingsdorf aardewerk.Van deksels van kogelpotaardewerk zijn in Nederland tot nog toe weinig exemplaren bekend. Zijn er dan ook wel aardewerken deksels gebruikt? Dit onderzoek bevat een bronnenonderzoek naar kogelpotaardewerk en mogelijke afsluitingen, evenals een materiaalstudie en gebruikssporenanalyse naar randfragmenten van kogelpotaardewerk, afkomstig van verschillendevindplaatsen uit de Noordoostpolder. Het doel van het onderzoek was het identificeren van mogelijk gebruikte afsluitingen op kogelpotaardewerk.",,,,https://hbo-kennisbank.nl/details/saxion_scripties:4ffa3eb3-1335-410d-8abc-5f1b242e8a33
Dilemma’s rond langer thuiswonen van ouderen,"De Nederlandse overheid ontwikkelde beleid om bij de verwachte bevolkingsopbouw in 2040 – met een relatief groot aantal oudere ouderen - de beperkt beschikbare professionele zorg zo efficiënt mogelijk, toegankelijk, betaalbaar en van hoge kwaliteit te houden. Ouderen wonen daarom langer thuis, zijn zelfredzaam en zorgen voor elkaar. Dit maakbaarheidsdenken vraagt om reflectie op normatieve en existentiële dimensies om te komen tot een betekenisvolle transformatie die ‘deugt en deugd doet’. Recent overheidsbeleid over langer thuiswonen van ouderen is in kaart gebracht en hoe adviesraden rondom politiek en openbaar bestuur dit beleidsvraagstuk duiden. Onderzoekers verkenden waarden en normen in reflectieve dialogen met ouderen, beleidsmakers, zorgprofessionals en opleiders. Een aantal dilemma’s rond dit beleid zijn geconstateerd: het beleid gaat uit van maakbaarheid en energieke ouderen, het beheersingsvraagstuk is enorm, de beleidskaders knellen voor professionals en ouderen hebben nauwelijks stem. De slotbeschouwing roept op om in beleid en professioneel handelen deze ambivalentie een plek te geven.",,,,https://hbo-kennisbank.nl/details/sharekit_che:oai:surfsharekit.nl:c2c19597-8d46-4b5c-8f5c-50784d2a2897
Spelen met de gedachte,"Dit praktijkgerichte, kwalitatieve onderzoek richt zich op de vraag: op welke wijze kan improvisatiespel binnen dramatherapie worden ingezet in de behandeling van volwassenen met een borderlinepersoonlijkheidsstoornis (BPS) en chronische suïcidaliteit? Deze doelgroep kenmerkt zich door een hoge mate van lijdensdruk, emotionele ontregeling en vastgelopen behandeltrajecten, waarbij de huidige GGZ-zorg zich veelal richt op risicobeheersing in plaats van herstelgerichte behandeling. Het onderzoek is uitgevoerd aan de hand van literatuuronderzoek en halfgestructureerde interviews met dramatherapeuten en andere GGZ-professionals die ervaring hebben met het werken met cliënten met BPS en chronische suïcidaliteit. De verzamelde data zijn kwalitatief geanalyseerd, thematisch gecodeerd en geordend.Uit de resultaten blijkt dat improvisatiespel binnen dramatherapie een waardevolle bijdrage kan leveren aan de behandeling van deze doelgroep, mits het wordt aangeboden binnen duidelijke en veilige kaders. Een authentieke, transparante, onderzoekende, niet-oordelende en gelijkwaardige therapeutische houding blijkt essentieel voor het waarborgen van basisveiligheid. Improvisatiespel ondersteunt het vergroten van emotieregulatie, mentalisatie, lichaamsbewustzijn en het onderzoeken van onderliggende patronen die samenhangen met chronische suïcidaliteit. Tegelijkertijd vraagt het werken met deze doelgroep om specifieke aandacht voor risico’s en aandachtspunten, zoals overspoeling en ontregeling, zelfzorg en reflectie vanuit de behandelaar en om voortdurende afstemming op de draagkracht van de cliënt. Op basis van de onderzoeksresultaten is een eindproduct ontwikkeld in de vorm van informatieve video’s voor cliënten en behandelaren. Dit onderzoek draagt bij aan de beroepspraktijk door inzicht te geven in de inzet van improvisatiespel binnen dramatherapie bij chronische suïcidaliteit en BPS en vergroot de zichtbaarheid van dramatherapie binnen de GGZ.",,,,https://hbo-kennisbank.nl/details/sharekit_hu:oai:surfsharekit.nl:8609343e-cd0b-4586-8c39-5bea83390444
De urban curator als noodzakelijke verbinder in de lokale energietransitie,"Een van de meest veelbelovende scenario’s voor de energietransitie is de overgang naar duurzame, lokaal opgewekte en gedeelde energie. Landelijk sloegen ruim 700 burger-energiecollectieven deze weg al in. Maar het is een lastig traject, waarbij de wensen en capaciteit van lokale gemeenschappen afgestemd moeten worden op bestaande en nieuwe institutionele prakijken, wetten en regelgeving. Wie legt de verbindingen? Het onderzoeksproject Transition-Scapes verkende de afgelopen tijd samen met Huis van de Toekomst in Rotterdam hoe ‘urban curators’ een rol kunnen spelen als verbinders, aanjagers en facilitators in een andere manier van denken en samenwerken rond de energietransitie. Het gaat hier namelijk om een technische opgave, maar evenzeer om een complex sociaalmaatschappelijk verandervraagstuk. De Rijksoverheid streeft naar een CO2-neutrale economie in 2050 en stimuleert hiertoe het gebruik van hernieuwbare energiebronnen die onze aarde en leefomgeving niet beschadigen of vervuilen. Volgens dat scenario worden elektriciteit en warmte zoveel mogelijk in de buurt opgewekt, opgeslagen en verspreid. Hiervoor zijn nieuwe, grotendeels lokaal georganiseerde energiesystemen nodig: in bestaande buurten en in nieuwbouwwijken. De gemeentes en marktpartijen zijn hierin leidend, maar er gaan steeds meer stemmen op – onder andere bij het Nationaal Programma Regionale Energiestrategie en bij netbeheerder Alliander – om het eigenaarschap van deze lokale systemen in energiegemeenschappen onder te brengen.",,,,https://hbo-kennisbank.nl/details/amsterdam_pure:oai:pure.hva.nl:publications%2F30ef69aa-f484-483a-b539-5effc23ce716
Eindevaluatie KIEM,In dit rapport leest u eerst de bevindingen over de werkzaamheid van KIEM op de scholen. In het tweede deel volgen de bevindingen vanuit de kinderopvang. Vervolgens presenteren we een analyse aan de hand van drie casussen. Het rapport sluit af met een algehele conclusie en aanbevelingen voor KIEM.,,,,https://hbo-kennisbank.nl/details/hanzepure:oai:research.hanze.nl:publications%2Fa31ead6b-ebc8-48d3-a9d3-7a75da5c10f1
