title,abstract,date,department,type,url
Sociale inclusie: Kansen voor iedereen!,"In deze workshop wordt de complexiteit van interprofessioneel samenwerken met behulp van een Q-sort in kaart gebracht en met elkaar gedeeld middels de Think, Pair, Share methodiek. Na een korte introductie van het Samen Sterker project, gaan deelnemers aan de slag met het leggen van kaartjes om de balans tussen ervaren knelpunten en succesfactoren in de interprofessionele samenwerking in kaart te brengen. Door in gesprek te gaan over de ervaren samenwerking, wordt de focus gelegd op de aspecten die de deelnemers belangrijk vinden én waar ze invloed op uit kunnen oefenen. De deelnemers reflecteren dus op de eigen samenwerkingspraktijk én gaan naar huis met een concreet hulpmiddel (de Q-sort) om de eigen samenwerking met collega's onder de loep te stellen.",,,,https://hbo-kennisbank.nl/details/hanze_pure_rest:f8e04a42-27f2-450e-afed-1bae9ad540c1
Cobots voor High-tech Assemblage Toepassingen (CHAT),Eindrapportage van het onderzoek naar de inzet van systemen met cobots voor complexe (high-tech) assemblage toepassingen. Onderdeel van het project: Cobots voor High-tech Assemblage Toepassingen (CHAT).,,,,https://hbo-kennisbank.nl/details/sharekit_windesheim:oai:surfsharekit.nl:1025bf04-b243-4dfd-92be-593a1a770a95
Duurzaam waterbeheer op private percelen binnen bedrijventerreinen,"Dit afstudeeronderzoek richt zich op de vraag hoe ondernemers op bedrijventerrein Zevenhont kunnen bijdragen aan duurzaam waterbeheer op perceelniveau. Met behulp van een gebiedsanalyse, een inventarisatie van maatregelen en een praktische Excel-tool is onderzocht welke mogelijkheden er zijn voor buffering en vertraagde afvoer van hemelwater. De analyse toont dat ondernemers, die 85% van het terrein bezitten, een cruciale rol spelen. Technisch zijn er op vrijwel elk perceel passende maatregelen mogelijk, maar de bereidheid om te investeren blijkt laag. Ondernemers ervaren vaak geen urgentie o f verantwoordelijkheid en missen kennis. De conclusie is dat duurzaam waterbeheer alleen haalbaar is met duidelijke regie vanuit de gemeente, inclusief financiële stimulansen en een prikkelend beleid.",,,,https://hbo-kennisbank.nl/details/sharekit_windesheim:oai:surfsharekit.nl:a888708f-aa5a-41f8-b91a-eb3c8df18263
Het moet van beide kanten komen,"Dit onderzoek ‘Het moet van beide kanten komen’, is vanuit het Lectoraat Werkzame Factoren in de Jeugd- en Opvoedhulp tot stand gekomen. Voor dit onderzoek is er beeldmateriaal van twee IAG-studenten gecodeerd en geanalyseerd aan de hand van de SOFTA (Friedlander et al., 2005). Dit onderzoek heeft als doel om zicht te krijgen op de invloed van de normen en waarden, van zowel de hulpverlener als de cliënten met diversesociaal culturele achtergronden op de samenwerkingsrelatie. De aanleiding hiervoor is dat de Nederlandse samenleving steeds diverser wordt (NJi, z.d.). Daarnaast hebben IAG studenten aangeven aan dat zij regelmatig vastlopen in de samenwerkingsrelatie met gezinnen, wat vaak te herleiden is naar de normen en waarden (persoonlijke communicatie, maart 2025).De hoofdvraag van het onderzoek is: “Hoe beïnvloeden normen en waarden van hulpverleners en cliënten met diverse sociaal-culturele achtergronden de samenwerkingsrelatie?"".",,,,https://hbo-kennisbank.nl/details/sharekit_han:oai:surfsharekit.nl:9918eddf-7397-4860-ae9f-0ea18cb5d838
Slow Burn. The Everyday consequences of Climate Change.,"Book review of: R. Jisung Park (2024). Slow Burn. The Hidden Costs of a Warming World, Princeton University Press, 336 pp.",,,,https://hbo-kennisbank.nl/details/amsterdam_pure:oai:pure.hva.nl:publications%2Fb60ce06a-7806-4245-8c43-e146f5c886bb
What motivates students to participate in honours programs?,,,,,https://hbo-kennisbank.nl/details/hanzepure:oai:research.hanze.nl:publications%2F2cdbb419-357b-4544-99ab-186ec83fc6d4
Ontwerpprincipes voor effectieve docentprofessionalisering gericht op didactische vaardigheden,"Docentprofessionalisering kan op verschillende manieren worden vormgeven en met verschillende doelen. Vaak heeft een formeel professionaliseringsprogramma de vorm van een leergang of meerdaagse training, met als doel de didactiek - de wijze waarop het leren wordt georganiseerd in werkvormen, instructie en materialen - van docenten te verrijken. De verwachting is dat docenten die deelnemen aan een dergelijk programma de nieuwe didactiek toepassen in hun eigen onderwijs en dat studenten hiervan profiteren. Dat is niet de realiteit: professionaliseringsprogramma's zijn zelden effectief in het realiseren van nieuwe didactiek.",,,,https://hbo-kennisbank.nl/details/hanzepure:oai:research.hanze.nl:publications%2F5a7fdd97-0d17-40db-9c1f-c6c5e3656549
Software architecture for machine learning to aid sustainable digital transformation,"Context: Rapid developments and adoption of machine learning-based software solutions have enabled novel ways to tackle our societal problems. The ongoing digital transformation has led to the incorporation of these software solutions in just about every application domain. Software architecture for machine learning applications used during sustainable digital transformation can potentially aid the evolution of the underlying software system adding to its sustainability over time. Objective: Software architecture for machine learning applications in general is an open research area. When applying it to sustainable digital transformation it is not clear which of its considerations actually apply in this context. We therefore aim to understand how the topics of sustainable digital transformation, software architecture, and machine learning interact with each other. Methods: We perform a systematic mapping study to explore the scientific literature on the intersection of sustainable digital transformation, machine learning and software architecture. Results: We have found that the intersection of interest is small despite the amount of works on its individual aspects, and not all dimensions of sustainability are represented equally. We also found that application domains are diverse and include many important sectors and industry groups. At the same time, the perceived level of maturity of machine learning adoption by existing works seems to be quite low. Conclusion: Our findings show an opportunity for further software architecture research to aid sustainable digital transformation, especially by building on the emerging practice of machine learning operations. Keywords Digital transformationSustainabilityMachine learningSoftware architectureMLOps",,,,https://hbo-kennisbank.nl/details/hanzepure:oai:research.hanze.nl:publications%2Fe5f57202-14f1-4988-9bd9-e8a882a41fd0
Vergroting van museumtoegankelijkheid  voor personen met een visuele beperking,"Dit afstudeeronderzoek richt zich op het verbeteren van de toegankelijkheid vanmuseale tentoonstellingen voor mensen met een visuele beperking. Musea zijn vanoudsher sterk visueel ingesteld, waardoor deze doelgroep vaak wordt uitgesloten vaneen gelijkwaardige beleving. In samenwerking met Tijdlab is onderzocht hoetechnologie, in het bijzonder 3D-geprinte objecten en Near Field Communication(NFC), kan bijdragen aan zelfstandige, informatieve en inclusieve museumervaringen.",,,,https://hbo-kennisbank.nl/details/saxion_scripties:7225c3f2-a86a-4f60-a16a-439de26752c9
Inclusief werkgeverschap : voedingsbodem voor vrouwelijk leiderschap,"In dit artikel verkennen we de (verhouding tussen de) twee centrale begrippen vrouwelijk leiderschap en inclusief werkgeverschap: In hoeverre biedt inclusief werkgeverschap een rijke voedingsbodem (of vormt het zelfs een noodzakelijke voorwaarde) voor vrouwelijk leiderschap? We starten deze bijdrage met een overzicht van fundamenteel en praktijkgericht onderzoek omtrent vrouwen in leiderschapsfuncties. Hierna bespreken we kenmerken van en voorwaarden voor inclusief werkgeverschap, met expliciete aandacht voor inclusief leiderschap. Vervolgens presenteren we een casus van vrouwen in de ICT-sector en sluiten we deze bijdrage af met concrete handvatten voor werkgevers en hr-professionals.",,,,https://hbo-kennisbank.nl/details/sharekit_windesheim:oai:surfsharekit.nl:35059d66-d4ce-4701-8e33-15bc407a9efc
Van zero-emissie naar zero-impact stadslogistiek: wat leert de Nederlandse casus?,"Zero-emissiezones (ZE-zones) worden vaak gepresenteerd als een ‘no-regret’ maatregel voor schonere en beter leefbare steden. De Nederlandse invoering van ZE-zones laat echter een meer genuanceerde werkelijkheid zien. Sinds 1 januari 2025 hebben achttien gemeenten ZE-zones in hun binnensteden ingevoerd, na een decennium van nauwe samenwerking tussen overheid, logistieke bedrijven en NGO’s. Deze zones geven richting aan de markt, versnellen innovaties in voertuigen, laadinfrastructuur en stedelijke logistieke concepten, en passen binnen een bredere transitie naar duurzame stedelijke omgevingen. Toch zijn de directe luchtkwaliteits- en klimaatvoordelen bescheiden in vergelijking met de potentiële impact op het interregionaal zwaar vrachtvervoer, waar elektrificatie aanzienlijk grotere CO₂-reducties oplevert. De implementatie wordt begrensd door netcongestie, gefragmenteerde uitzonderingsregimes en administratieve complexiteit, en brengt het risico met zich mee dat er een ongelijk speelveld ontstaat dat kleinere bedrijven benadeelt. In dit position paper reconstrueren we de tienjarige implementatieperiode van ZE-zones en reflecteren we op de vraag of ZE-zones daadwerkelijk ‘no-regret’ maatregelen zijn en hoe ze dat kunnen worden. Wij stellen dat ZE-zones pas echt ‘no-regret’ worden wanneer zij zijn ingebed in een bredere strategie voor zero-impact stedelijke logistiek en emissiereductie in het goederenvervoer, met een combinatie van infrastructuur, eerlijke ondersteuning van MKB-bedrijven en structurele veranderingen in logistieke netwerken en governance.",,,,https://hbo-kennisbank.nl/details/amsterdam_pure:oai:pure.hva.nl:publications%2F633915d6-d709-4126-a5cf-6098bc32903f
Reimagining the Housing Landscape,"The approach to homelessness in the Netherlands is currently undergoing a paradigm shift, moving away from shelter-based systems toward direct and unconditional housing, as articulated in the National Action Plan on Homelessness Eerst een Thuis. However, the regular housing supply often fails to meet the diverse needs of young people experiencing homelessness, whose situations are shaped by high stress levels, instability, and frequently trauma. This research explores how alternative housing concepts can better respond to these needs by focusing on the hardware dimension of housing design—its spatial, material, and architectural qualities. Existing initiatives to enrich housing concepts for people experiencing homelessness tend to focus mainly on the software aspects of community living, emphasizing social cohesion, collective activities, and supportive networks. This paper complements and challenges that emphasis by foregrounding the need for imaginative hardware interventions—architectural, spatial, and material solutions that can meaningfully expand the architectural repertoire of youth housing, and better respond to the needs of the diverse group of young people facing homelessness. Conducted within the Master of Architecture programme and the Real Estate Professorship of the NoorderRuimte Research Center at the Hanze University of Applied Sciences in Groningen, the study was grounded in a participatory design process involving students, researchers, local stakeholders and experts by experience. The insights and lived experiences of young people served as the starting point, ensuring that their needs and various profiles informed all stages of the design exploration. The theoretical framework combines principles of healing architecture and trauma-informed design, acknowledging that experiences of homelessness often go hand in hand with elevated stress and trauma, and that the built environment can play an active role in fostering safety, autonomy, and wellbeing. The research-by-design process resulted in a wide spectrum of creative spatial directions aimed at enriching the current housing landscape. These directions range from acupunctural interventions within existing social housing stock, to reinterpretations of historical urban typologies such as the hofjes, to integrated design strategies embedded within broader transition agendas like climate adaptation. Other explorations focus on design processes that create opportunities for ownership, agency, and active participation by young people throughout construction. To sum up, these design outcomes propose new ways to enhance destigmatisation, social cohesion, empowerment and personal development for young people facing homelessness in Groningen, while contributing to a more diverse and imaginative Dutch housing landscape.",,,,https://hbo-kennisbank.nl/details/hanzepure:oai:research.hanze.nl:publications%2F7be90e18-443e-4e76-8740-ef2866314015
Eenheid van autoluwe binnensteden,"Nederlandse steden willen hun binnensteden autoluwer maken om leefbaarheid, veiligheid en duurzaamheid te verbeteren, maar dit stuit vaak op weerstand van bewoners en ondernemers onder meer door een gebrek aan gedeelde kennis. Dit onderzoek laat zien dat autoluw beleid vooral succesvol is wanneer maatregelen samenhangend en grootschalig worden toegepast, gecombineerd met goede inrichting van de openbare ruimte en actieve betrokkenheid van stakeholders. De belangrijkste lessen zijn: kies voor een integrale aanpak, richt straten echt in als verblijfsruimte, betrek belanghebbenden vroeg, zorg voor politieke steun en presenteer autoluw beleid als middel (niet doel) binnen bredere stedelijke ambities. Deze afstudeerscriptie bestaat uit twee delen: 'Eenheid van autoluwe binnensteden: lessen uit praktijkervaringen voor effectief beleid' en 'Lessen van autoluwe binnensteden: praktische handreiking voor gemeenten en adviesbureaus'.",,,,https://hbo-kennisbank.nl/details/sharekit_windesheim:oai:surfsharekit.nl:311da376-b4a6-4139-b147-3a37361e15c9
Regeneratieve landbouw,"Regeneratieve landbouw (RL) beoogt bodemherstel, verhoging van biodiversiteit en reductie van emissies in grootschalige aardappel- en groenteteelt. Deze scriptie onderzoekt hoe de Europese mechanisatiesector—van fabrikanten tot dealers—de transitie kan versnellen door machines en diensten te ontwikkelen die RL-principes ondersteunen. Interviews met vijf toonaangevende bedrijven tonen dat demonstraties 'proof-in-practice', data-gestuurde ondersteuning en langlopende servicecontracten essentieel zijn om telers te overtuigen. Ketenbrede samenwerking, meet- en monitoringssystemen (MMRV) en passende financiering blijken randvoorwaardelijk voor grootschalige adoptie. Het werk sluit af met een stappenplan waarmee mechanisatiebedrijven hun portfolio, marketing en after-sales kunnen herinrichten om een toekomstbestendig, regeneratief landbouwsysteem mogelijk te maken.",,,,https://hbo-kennisbank.nl/details/aereshogeschool:oai:www.greeni.nl:VBS:2:153560
Automated Tracheal Morphometrics Using Deep Learning: Toward Custom Tracheostomy Tubes,"Tracheostomy is a life-saving procedure with complications often linked to suboptimal tracheostomy tube fit. Customised tubes could reduce these risks, but their development requires precise tracheal morphometric data. This study presents an automated workflow for extracting high-resolution tracheal measurements from CT scans, using 3D Slicer and a deep learning segmentation model (VISTA-3D). One hundred anonymised scans were analysed, with 90 included after exclusions. Automated measurements revealed average tracheal lengths of 66.1±12.2 mm, anteroposterior dimensions of 16.2±2.5 mm, transverse dimensions of 17.9±2.4 mm, and maximum inscribed circle diameters of 14.1±1.9 mm. Sex-specific differences were observed, with males exhibiting larger dimensions. The results align with existing literature, validating the automated approach. This method enables efficient, objective, and high-resolution morphometric analysis, supporting the development of demographic-specific tracheostomy tubes and improving pre-operative planning.",,,,https://hbo-kennisbank.nl/details/saxion_kenniscentra:b43cbb33-2d86-41c6-bcbb-332d8611c6dc
Gedeelde besluitvorming in de triade bij onbegrepen gedrag,"In dit artikel vertel ik waar mijn promotieonderzoek over gaat en waarom het voor mij belangrijk en leuk is om aan te werken, de opzet van het promotietraject en relevantie van het onderzoek komen daarnaast aan bod.",,,,https://hbo-kennisbank.nl/details/hanzepure:oai:research.hanze.nl:publications%2F210920f0-e10a-4020-9753-cbb9eb02c341
"What can I make in the future? Artistic research on flax and clay in past-, present-, and future environmentally sustainable design practices","For designers, materials and production processes are crucial to the creation and quality of products like tablecloth and clay jars. Nowadays, utilitarian objects are mass- produced, far away. This contributes to environmental degradation, ecological imbalance and a loss of crafts and knowledge. To understand what we can still make in the future, we must explore the cultural history of flax and clay and their (past) manufacturing processes. By replication, we gain a deeper understanding of the production methods, craftsmanship, materials, and their origins. We explore the economic challenges in responsible use of natural resources for contemporary textile and ceramic design organizations. Through artistic reflection and scientific research on the past and present, we aim towards a vision for future design practices that use local materials leading to environmentally sustainable designs that enhance ecological balance.",,,,https://hbo-kennisbank.nl/details/hanze_pure_rest:62f05c00-f393-4812-9e38-4a6dbc9a2316
Lifestyle Change,"In de wijk Colmschate in Deventer komen buurtbewoners wekelijks bij elkaar bij voetbalvereniging S.V. Helios en verbindingscentrum De Vijfhoek. Op verschillende plekken in de wijk worden mensen uitgenodigd om binnen te komen, aan te schuiven en mee te doen. De deur staat altijd open en iedereen is welkom. Wat begon als een burgerinitiatief, is inmiddels een uitgebreide beweging - Buurtgeluk - met een scala aan vrijwilligers, betrokken organisaties en meerdere interventies. Omzien naar elkaar is de kern.Een van de specifieke interventies die bij Buurtgeluk wordt uitgevoerd is Lifestyle Change, gericht op positieve veranderingen in het leven van de deelnemers. Mensen die actief zijn bij Buurgeluk stromen in bij Lifestyle Change op het moment dat de wens van andapos;iets willen doen voor een anderandapos; verandert in andapos;iets willen doen voor zichzelf. Dit kan een of meerdere leefgebieden raken. Soms stromen mensen direct in. Vaak zijn deze mensen doorverwezen door een zorgprofessional. De start bij Lifestyle Change wordt gemarkeerd met toegang tot de bijbehorende app. In de app kan de deelnemer diens eigen vooruitgang bijhouden en delen met een of meerdere coaches.",,,,https://hbo-kennisbank.nl/details/saxion_kenniscentra:045f2bd0-aff6-46b3-9f2b-d0aff656b34e
Informatiebehoeften van transmannen over de logopedische behandeling bij genderdysfonie,"Inleiding: Transmannen zijn onderbelicht in de wetenschappelijke literatuur, die zich voornamelijk richt op transvrouwen. Dit onderzoek richt zich op de ervaringen en behoeften van transmannen met betrekking tot de informatievoorziening over de logopedische behandeling bij genderdysfonie. Het onderzoek heeft als doel om de zichtbaarheid van de logopedische zorg binnen deze doelgroep te vergroten. Ook draagt het bij aan de profilering van het beroep logopedie, specifiek op dit relatief nieuwe vakgebied voor de logopedist.Methode: Dit kwalitatieve onderzoek is uitgevoerd aan de hand van semigestructureerde interviews. De interviews zijn afgenomen via Microsoft Teams en hadden een duur van 30 tot 60 minuten. De interviews waren gericht op het verzamelen van de ervaringen, behoeften, wensen en suggesties van transmannen. De participanten zijn geworven via een combinatie van een sneeuwbalsteekproef en een gelegenheidssteekproef. De interviews zijn getranscribeerd en daarna geanalyseerd met Word en Excel.Resultaten: Er deden vier transmannen mee aan dit onderzoek. De transmannen beschouwen de stem (in het bijzonder de toonhoogte) als kenmerkend voor hun genderidentiteit. Ze geven aan niet bekend te zijn met de logopedische behandeling bij genderdysfonie. Ze hebben niet actief informatie vergaard. Één transman is wel bekend met de logopedische behandeling en heeft op internet informatie vergaard. Hij ervaart de informatie onvolledig om een duidelijk beeld te kunnen vormen over de meerwaarde van logopedie bij genderdysfonie. De transmannen vinden de informatievoorziening onvoldoende. Ze hebben behoefte aan proactieve voorlichting van de psycholoog over de mogelijkheid van logopedie bij genderdysfonie. Ook hebben ze behoefte aan informatie over de inhoud, opbouw en de verwachte opbrengst van het logopedisch behandeltraject bij genderdysfonie. De transmannen hebben gevarieerde suggesties aangedragen voor het verbeteren van de informatievoorziening.Discussie: Uit dit onderzoek kan voorzichtig worden geconcludeerd dat de logopedische behandeling bij genderdysfonie momenteel onvoldoende zichtbaar is voor transmannen. Dit beïnvloedt hun informatiebehoefte  en draagt mogelijk bij aan onderbehandeling. Gezien de opzet en reikwijdte van dit onderzoek kunnen de resultaten niet worden gegeneraliseerd naar de gehele populatie transmannen. Zowel de NVLF als logopedisten wordt aanbevolen in hun informatievoorziening expliciet aandacht te besteden aan de inhoud, opbouw en opbrengst van het logopedisch behandeltraject. Vervolgonderzoek bij transmannen die actief informatie hebben vergaard over de logopedische behandeling bij genderdysfonie kan aanvullend inzicht bieden.",,,,https://hbo-kennisbank.nl/details/sharekit_hhs:oai:surfsharekit.nl:001d4977-17c8-4183-b926-a7b84378b66f
User evaluation of a virtual reality simulation for anaesthesiologists-intensivists for non-technical skills,"Objective: Simulation training in medical settings is a cornerstone in medical education to practice technical andnon-technical skills. The objective of this study was to evaluate user experiences and initial reactions to amultiplayer virtual reality (VR) simulation designed for anaesthesiologists.Methods: A user-centred design approach guided the development of a VR-scenario training simulating a case ofmassive blood loss. Seven anaesthesiology residents and trainers from a Dutch academic hospital participated inqualitative and quantitative evaluations. Quantitative measures included questionnaires on presence, agency,physical dyscomfort, and perceived training value. Qualitative data were collected through structured observations and interviews.Results: Participants reported a high sense of physical presence and moderate agency, with lower levels of selfpresence. The VR environment was perceived as realistic and engaging. Challenges included unfamiliarity withVR controls, abstract avatars, and limited haptic feedback. Despite these barriers, participants recognized thepotential of VR for team-based learning of non-technical skills, especially with prior onboarding or practicesessions.Innovation: This study introduces a novel application of multiplayer VR simulation in anaesthesiology training,focusing on non-technical skills. The integration of user-centred design with qualitative and quantitative evaluation provides insights into the feasibility and acceptability of VR as an educational tool in this context.Conclusions: VR simulation shows promise for training non-technical skills in anaesthesiology. While participantsappreciated the realism and collaborative aspects, enhancements in usability and interaction design are necessary for broader implementation and impact.",,,,https://hbo-kennisbank.nl/details/saxion_kenniscentra:1b7dec38-d3d8-426a-bdec-38d3d8826a49
NeedForHeat DataGear : An Open Monitoring System to Accelerate the Residential Heating Transition,"We introduce NeedForHeat DataGear: an open hardware and open software data collection system designed to accelerate the residential heating transition. NeedForHeat DataGear collects time series monitoring data in homes that have not yet undergone a heating transition, enabling assessment of real-life thermal characteristics, heating system efficiency, and residents' comfort needs. This paper outlines its architecture and functionalities, emphasizing its modularity, adaptability, and cost-effectiveness for field data acquisition. Unlike conventional domestic monitoring solutions focused on home automation, direct feedback, or post-installation heat pump monitoring, it prioritizes time series data we deemed essential to evaluate the current situation in existing homes before the heating transition. Designed for seamless deployment across diverse households, NeedForHeat DataGear combines openness, security, and privacy with a low-cost, user-friendly approach, making it a valuable tool for researchers, energy professionals, and energy coaches.",,,,https://hbo-kennisbank.nl/details/sharekit_windesheim:oai:surfsharekit.nl:cc2ece10-4cbc-4ba2-b6d2-386aaeaac450
