title,abstract,date,department,type,url
Needs Analysis to Define a Digital Learning Game Aimed at Coping with Mathematics Anxiety,"Mathematics anxiety is a well-documented phenomenon affecting students' learning experiences, engagement, and long-term career choices. This research is part of a wider effort to mitigate and prevent mathematics anxiety through the development of a digital learning game, supported by a follow-up teacher professional development programme. Previous research highlights a critical gap in the availability of games specifically designed to mitigate mathematics anxiety and promote learning and emotional well-being. This paper focuses on the needs analysis phase of a game development process. The research follows the design-based approach, in which the first step involves identifying needs and defining educational objectives. The needs analysis is designed on a multinational basis by an interdisciplinary research team from five European countries. It aims to identify the requirements of teachers and students for the digital learning game based on a literature review, an analysis of mathematics curricula in the five European countries, as well as surveys conducted among teachers, students, and parents. Focus group interviews in these five countries deepen the understanding of teachers’ needs and perspectives. Results from the analysis will guide the design stage and contribute to the creation of game mechanics that align with the learning goals. Later, the game will be iteratively built, tested and improved together with teachers and students. The needs analysis and definition of game requirements are carried out by a multidisciplinary team using co-design methods. The team includes experts from the fields of mathematics, game development, pedagogy, mental health and co-design. In addition to developing a digital learning game, the game is particularly aimed at supporting emotional well-being and engagement of the player in order to mitigate anxiety related to learning maths. Preliminary results from needs analysis reveal that specific game mechanics, modular design, and a positive psychology approach are considered essential in supporting student´s learning and well- being. The results form the basis for the further game design.",,,,https://hbo-kennisbank.nl/details/amsterdam_pure:oai:pure.hva.nl:publications%2F734ecb49-f81d-444c-af22-f3c431e1d589
"Investigating the Expression and Function of α4ß2-Nicotinic  Acetylcholine Receptors within the Central Nucleus of the  Amygdala in the Rodent Brain, as well as Their Involvement in  the Behavioural and Social Regulation of Mice Impacted by  Addictive Substances","Nicotine is a well-known and highly addictive substance with complex effects on cognition, anxiety, and neurophysiology. Despite its short-term anxiolytic effects, this drug often exacerbates anxiety symptoms. It disrupts emotional regulation through its impact on the central nucleus of the amygdala (CeA) – a key brain region for stress and sensory processing that is susceptible to drug-related stimuli. The nicotinic acetylcholine receptors (nAChRs) of the cholinergic system play a crucial role in nicotine addiction, enhancing synaptic plasticity by promoting neurotransmitter release and supporting long-term memory formation. Different receptor subtypes have distinct effects, and this study aims to investigate the role of the a4b2 nACh receptors and their co-localisation with stress-regulating neuropeptide Y (NPY) neurons within the CeA, focusing on their potential involvement in neuronal morphology, synaptic plasticity, and social behavioural changes. Analysis of fluorescent in situ hybridisation (FISH) images confirmed co-localisation of NPY and a4b2 nAChR markers, suggesting potential interconnected involvement in various neuronal pathways. After determining the correct coordinates for the CeA during stereotaxic surgeries, CaMKII-Cre-GFP and CMV-Cre-GFP viruses were injected into both TOM and ChAT/TOM mice to reveal the potential presence of spiny neuronal populations. The method was validated for use, but the signals expressed high background noise, which limited the structural analysis of neuronal morphology. In contrast, NPY-Cre mice showed more specific labelling, though dendritic spine density remained low compared to cortical pyramidal neurons. Thus, the neuronal population in the CeA does not exhibit enough spines to serve as a proxy to interrogate synaptic plasticity, so other technological approaches need to be implemented to search for such activity. Because the CeA plays a role in the control of social behaviour, the effects of acute nicotine administration were tested in this behavioural domain. Acute nicotine injections (0.5 mg/kg) consistently reduced social interaction time in mice across tests (Three Chamber Test, Social Interaction Test, MEGIT, and Resident-Intruder Test), without impairing locomotion, social preference, orsocial memory. These findings suggest that nicotine does not affect social behaviour and social motivation, but it reduces overall social interaction and explorative tendencies. While the CeA may not be the primary site for nicotine-driven spine-specific synaptic plasticity affectingbehaviour, the results showcase the importance of ongoing investigation into nicotine’s influence on neural circuits, emotional processing, and behavioural mechanisms.",,,,https://hbo-kennisbank.nl/details/sharekit_han:oai:surfsharekit.nl:49f215e2-d1f6-4f62-b63e-adccafd6bdd9
Samen sterker in het onderwijs,,,,,https://hbo-kennisbank.nl/details/hanzepure:oai:research.hanze.nl:publications%2F9f4d6c00-34a3-4dc3-a5aa-a6259dea55c0
Frailty assessment in middle-aged and older patients with burn injuries,,,,,https://hbo-kennisbank.nl/details/hanzepure:oai:research.hanze.nl:publications%2F2078b29b-2b80-4fec-affa-0595d9532739
Roadshow Health Noord,"Tijdens de roadshow Health Noord Hanze maakten deelnemers kennis met het grootschalige Health Noord-project, dat zich richtte op het beschikbaar en betaalbaar houden van kwalitatief goede zorg in Noord-Nederland door inzet van technologie en versterking van de regionale innovatiekracht. De focus lag op de volledige zorgketen, waaronder VVT, ziekenhuizen en preventie.De roadshow bood inzicht in het project, kansen om te netwerken met professionals en onderzoekers binnen Hanze en ruimte om raakvlakken en samenwerkingen te verkennen.",,,,https://hbo-kennisbank.nl/details/hanze_pure_rest:51502f70-7323-42f3-a570-d2dbb34bad7c
Neural correlates of metacognition in education: a machine learning approach,"Metacognition, the ability to reflect and regulate one's cognitive processes, has been shown to play a role in various aspects of life, particularly in academic settings. While important steps have been made in uncovering the neural basis of metacognition for highly specific domains (such as perceptual and mnemonic decision-making), little is known about how these findings relate to general forms of metacognition relevant in education. In this study, we use a data-driven approach to (i) identify brain regions associated with metacognition in education, and (ii) investigate the issue of domain-generality and to what extent these brain regions overlap with regions involved in metacognition in the context of specific decision-making tasks used in cognitive neuroscience. Individual differences in grey-matter volume in the precuneus and neighbouring brain regions were associated with education-related metacognitive knowledge and regulation. We also found overlaps between task-related mnemonic metacognitive abilities and education-related metacognitive knowledge, for example in in the superior frontal cortex. There were also regions specifically associated with metacognition in education, such as the banks of the superior temporal sulcus. Together, our findings suggest a link between lab-setting, domain-specific metacognitive abilities and real-life metacognition in the context of education.",,,,https://hbo-kennisbank.nl/details/amsterdam_pure:oai:pure.hva.nl:publications%2F57c9ef96-0b27-4742-ad6a-b1c33a9f3cea
Hoe klinkt vergeving?,"Dit praktijkgerichte onderzoek verkent hoe vergevingsinterventies en muziektherapie gecombineerd kunnen worden om het persoonlijk herstel van volwassenen met ernstige psychische aandoeningen (EPA) te ondersteunen. De centrale vraag is hoe deze twee methoden elkaar kunnen versterken.Het onderzoek, uitgevoerd in de context van GGZ Reinier van Arkel, combineert literatuurstudie met kwalitatieve, half gestructureerde interviews met zeven interne en externe deskundigen en twee cliënt-respondenten. De data is geanalyseerd door middel van thematische codering.De resultaten tonen aan dat vergeving, met name zelfvergeving, een betekenisvolle rol kan spelen in het persoonlijk herstel van EPA-cliënten door het helpen doorbreken van schuldgevoelens en slachtofferschap. Muziektherapie wordt gezien als een waardevolle non-verbale methode om de emotionele laag van vergeving te bereiken, waar verbale therapie beperkt is. Concreet worden combinaties voorgesteld zoals thematische improvisaties voor het exploreren van gevoelens, en songwriting voor het integreren van nieuwe inzichten.De conclusie is dat een gefaseerde combinatie van vergevingsinterventies en muziektherapie potentie heeft, op voorwaarde dat deze toegepast wordt binnen een herstelondersteunende, multidisciplinaire aanpak die de regie bij de cliënt laat. Het onderzoek resulteert in een prototype voor een behandelinterventie die in de praktijk verder ontwikkeld kan worden.",,,,https://hbo-kennisbank.nl/details/sharekit_hu:oai:surfsharekit.nl:7f6203cc-4ab5-495d-9641-151de96af47d
Barriers and opportunities with GREEN MOLECULES,,,,,https://hbo-kennisbank.nl/details/hanze_pure_rest:c067816c-a24d-49c5-b9cf-2804d0d90815
A meaningful and vibrant work environment,"Background and aim. Research highlights that poor workspace variety, poor zoning, and limited personalization can reduce comfort, privacy, and focus in hybrid environments. This study aims to anticipate these challenges and to develop and evaluate participatory design interventions for user-centred, efficient workplaces. Methods and data. This study adopted qualitative techniques, and was structured around a case study at an office in the Netherlands. The work environment was studied through needs assessments with interviews. Design interventions were subsequently explored in participatory focus groups, utilizing 3D scale models and 2D visualizations to facilitate collaborative input. Finally, these interventions were evaluated with end-users to determine their effectiveness in enhancing the hybrid work environment, focusing on comfort, functionality, and engagement. Results. The study revealed a lack in workplace diversity which compromised comfort and privacy. Additionally, the absence of clear zoning disrupted focused work and reduced workplace efficiency. There was also a lack of elements that foster personalization, identity, and positive experience, making the work environment less inviting and less inspiring for employees. Originality. By presenting solutions in direct interaction with users, valuable insights for facility management (FM) were gained into the supposed effectiveness of interventions in office design, organizational needs, and individual preferences. Practical implications. The use of 3D scale models and 2D visualizations can help FM to enhance the integration of organizational needs and user experiences, while simultaneously fostering employee engagement and a sense of ownership.",,,,https://hbo-kennisbank.nl/details/hanzepure:oai:research.hanze.nl:publications%2Feb536e16-f173-43b0-80d3-e8749164de9c
Hoe kan de mestkwaliteit het rendement van de melkveehouderij verbeteren in de toekomst?,"De studie onderzoekt hoe verbetering van mestkwaliteit het toekomstig rendement van Nederlandse melkveehouderijen kan verhogen. Aanleiding zijn sterk gestegen mestafzetkosten door het wegvallen van de derogatie en strengere milieuregels. Via literatuuronderzoek, interviews met 18 melkveehouders en enquêtes onder 24 akkerbouwers is vastgesteld dat vooral het stikstof- en fosfaatgehalte de economische waarde van mest bepaalt. Hoogwaardigere mest (vaste mest, compost) verlaagt de kosten per kilogram nutriënt en creëert nieuwe afzetkansen. Investeren in rantsoenoptimalisatie, zorgvuldige opslag en verwerkings-technieken versterkt zowel de financiële positie als de duurzaamheid van het bedrijf.",,,,https://hbo-kennisbank.nl/details/aereshogeschool:oai:www.greeni.nl:VBS:2:153823
Discriminatie in de klas,"Je zou verwachten dat jouw klas, als oefenplaats voor de samenleving, een veilige haven is. Een plek waar alle leerlingen zichzelf kunnen zijn en de ruimte krijgen om te groeien tot wie ze willen worden. Toch ervaren veel leerlingen dit in de praktijk anders.",,,,https://hbo-kennisbank.nl/details/amsterdam_pure:oai:pure.hva.nl:publications%2F1fb0abfa-5014-42c6-bca0-e631b6170d39
Verzwaringsdekens binnen de verstandelijk gehandicaptenzorg,"Binnen de zorg voor mensen met een verstandelijke beperking worden verzwaringsdekens vaak ingezet tegen onrust en slaapproblemen, maar duidelijke evidence-based richtlijnen over de inzet van verzwaringsdekens ontbreken. In opdracht van Stichting Pergamijn wordt daarom onderzocht hoe een stroomschema kan worden ontwikkeld dat therapeuten ondersteunt in het verantwoord en cliëntgericht gebruik van verzwaringsdekens.",,,,https://hbo-kennisbank.nl/details/sharekit_zuyd:oai:surfsharekit.nl:032d3175-ed6a-47a8-8ad7-28e694e403b1
Duurzame alternatieve materialen voor waterbouwkundige steigers,"Dit afstudeeronderzoek richt zich op de geschiktheid van alternatieve materialen voor vaste waterbouwkundige steigerconstructies, met als doel de milieu-impact te verlagen zonder concessies te doen aan veiligheid, functionaliteit en economische haalbaarheid. Aanleiding vormt de verduurzamingsopgave binnen de GWW-sector, waarin traditionele materialen zoals staal, beton en hout onder druk staan door hun hoge CO₂-uitstoot, grondstoffengebruik en onderhoudsintensiteit, met name in maritieme omgevingen.",,,,https://hbo-kennisbank.nl/details/sharekit_windesheim:oai:surfsharekit.nl:18ac834f-d65d-4ef3-829e-4bc8b0a2d8e1
WinVitality : Behouden & Verbeteren van Welzijn & Vitaliteit Studenten en Medewerkers,"In het eerder verschenen 'Whitepaper: Opbrengsten Verkenning Kwartiermakers Vitaliteit' stonden de achtergronden (aanleiding, werkwijze, wenkend perspectief en leidende principes) van de verkenning, door kwartiermakers Jasper Stege en Thomas Scheewe (hogeschool Windesheim) in samenwerking met tal van belanghebbenden uitgevoerd, centraal.Dit nieuwe WinVitality-document beschrijft de concretisering van de experimenten die we komende twee jaar voor ogen hebben. We bewegen daarmee, vanuit een integrale aanpak, in de richting van ons wenkend perspectief (visie). Dit plan is niet in beton gegoten (bekijk het document en dat wordt ongetwijfeld zichtbaar) maar in 'IJS'. En ijs, dat kun je bijschaven en bewerken.Dit WinVitality-plan is opgehangen aan IGLO(O)-model van Nielsen et al. Deze beschrijft hoe welzijn en vitaliteit tot stand komen door de samenhang tussen vijf niveaus: Individu, Groep, Leiders, Organisatie en de bredere Omgeving. Het model ondersteunt het streven van WinVitality om een duurzame beweging te creëren waarin welzijn en vitaliteit versterkt worden, op elk niveau van de hogeschool en háár omgeving, samen met die regio.Onderdeel van Verkenning Vitaliteit.",,,,https://hbo-kennisbank.nl/details/sharekit_windesheim:oai:surfsharekit.nl:0091dba9-aa4c-412e-9076-b57274abc5a9
Effect of stroboscopic vision on single leg hop for distance performance in athletes after anterior cruciate ligament reconstruction,,,,,https://hbo-kennisbank.nl/details/amsterdam_pure:oai:pure.hva.nl:publications%2F86b66863-9062-462b-b3b2-576951c91768
Staying engaged,,,,,https://hbo-kennisbank.nl/details/hanzepure:oai:research.hanze.nl:publications%2Fdeefdd4c-caf2-4e54-9815-e94c36778fbc
Digitale zorg in de jeugdgezondheidszorg: ontwikkeling en haalbaarheid van een zorgpad met e-consulten,"Inleiding: De JGZ nodigt op specifieke leeftijden alle ouders uit voor fysieke consulten om de ontwikkeling van het kind te volgen. Na validering van de Structured Problem Analysis of Raising Kids (SPARK) ontstond de mogelijkheid om de zorg te differentiëren op basis van de verschillende behoeften van gezinnen.Methode: Dit onderzoek startte met de ontwikkeling van een zorgpad met e-consulten voor peuters met laag risico. Na implementatie werden gezondheid en ontwikkeling van het kind gevolgd via door ouders ingevulde vragenlijsten. Ter evaluatie werd een consult op de leeftijd van 30 maanden uitgevoerd en werden gebruikerservaringen van ouders en jeugdverpleegkundigen uitgevraagd.Resultaten: Het bleek in de dagelijkse praktijk haalbaar om ouders en kinderen met een laag risico op opvoedings- en ontwikkelingsproblemen e-consulten aan te bieden, die hen ondersteunen. Binnen de projectduur zijn 106 e-consulten op 24 maanden, 81 op 30 maanden en 59 op 36 maanden uitgevoerd. Ouders waren zeer tevreden over de e-consulten, in tegenstelling tot jeugdverpleegkundigen.Beschouwing: Dit onderzoek liet veelbelovende mogelijkheden zien voor digitale zorg in de JGZ. Het perspectief van ouders motiveerde jeugdverpleegkundigen om door te gaan met e-consulten. Door te beginnen met een digitaal aanbod voor ouders en kinderen met laag risico, kan tijd vrijkomen om in te zetten voor ouders en kinderen met meer zorgbehoeften en hoger risico. Vervolgonderzoek naar de effectiviteit van e-consulten ten opzichte van fysieke consulten volgt.E-health; ouderschap; gezondheid van kinderen; ouderperspectief; relatieverpleegkundige-gezin",,,,https://hbo-kennisbank.nl/details/sharekit_che:oai:surfsharekit.nl:dd805166-3719-4e7d-8a30-f893bb98469a
StudentLines: building a regional infrastructure for educational data and research,,,,,https://hbo-kennisbank.nl/details/hanze_pure_rest:e1cab560-49d7-4775-ab63-9b2347f6383c
Van bed naar been op de orthopedische geriatrische revalidatie,"Deze literatuurstudie “Van bed naar been op de orthopedische geriatrische revalidatie”, heeftonderzocht welke vormen van training bijdragen aan het verbeteren van lopen en transfers bijorthopedische geriatrische revalidanten binnen een revalidatieperiode van maximaal zes weken.Binnen ZuidOostZorg (Marrewyk) bestaat er onzekerheid over hoe efficiënt de fysiotherapeutische aanpak is voor patiënten op de orthopedische afdeling. Op dit moment wordt er training gegeven, maar de fysiotherapeuten zijn benieuwd naar andere mogelijke vormen van training die bijdragen aan lopen en transfers. Met samenvatting in het Engels. Includes a summary in English.",,,,https://hbo-kennisbank.nl/details/sharekit_hhs:oai:surfsharekit.nl:1e7fe959-a93e-4d1f-a7c0-61b30c0a0b6d
Een stap dichterbij,"Dit rapport beschrijft een praktijkgericht onderzoek naar samenwerking tussen sociaal werkers, gemeenten en reformatorische burgers op de Biblebelt. De studie richt zich op de vragen, dilemma’s en handelingsverlegenheid die sociaal professionals en adviseurs beleid kunnen ervaren in hun dagelijkse werk met reformatorische burgers. Met een mixed-methoddesign (literatuuronderzoek, een survey onder 79 professionals, expert-interviews en focusgroepen) hebben de onderzoekers van de Christelijke Hogeschool Ede knelpunten en werkzame elementen in het professioneel handelen in kaart gebracht. De resultaten hiervan zijn zeven handreikingen. De thema’s zijn: reformatorische leefwereld, het opbouwen van een werkrelatie, het betrekken van de kerk, huwelijksproblemen, huiselijk geweld, opvoedingsproblemen en beleid. De handreikingen ondersteunen sociaal professionals en beleidsadviseurs bij religiesensitief werken. Het doel hiervan is een beter bereik van reformatorische inwoners en een betere samenwerking.",,,,https://hbo-kennisbank.nl/details/sharekit_che:oai:surfsharekit.nl:4e5dfd26-edc4-4cdf-82ff-9652e3305ec0
In gesprek met ouders over de rol van de brugfunctionaris,"Ouderbetrokkenheid draagt bij aan de ontwikkeling van kinderen. In de Gelderse Vallei werken basisscholen sinds 2024–2025 met brugfunctionarissen om de verbinding tussen school, thuis en zorg te versterken. Dit onderzoek richt zich op het perspectief van ouders, dat in eerder onderzoek onderbelicht bleef. Met behulp van een praatplaat zijn tien ouders geïnterviewd. Ouders ervaren versterkende factoren voor ouderbetrokkenheid in het contact met brugfunctionarissen: vertrouwen en toegankelijkheid, verbinding en praktische ondersteuning. Brugfunctionarissen vormen op deze manier een brug tussen ouders en zorg. Hun rol vraagt om verdere rolverheldering en borging, zodat deze ondersteuning ook na de subsidieperiode kan voortbestaan.",,,,https://hbo-kennisbank.nl/details/sharekit_che:oai:surfsharekit.nl:7a6b1c94-949d-4067-9bde-a5addd2f05f9
De waarden van groenblauwe netwerken in steden,"Meer aanwezigheid van groen (natuur) en blauw (water) in de stad helpt om steden klimaatadaptief te maken. Bovendien leveren groen en blauw in de stad een bijdrage aan de verbetering van biodiversiteit en leefbaarheid, en de gezondheid van de bewoners. Hoewel groenblauwe maatregelen intussen algemeen bekend zijn, worden ze nog niet vanzelfsprekend en op grote schaal toegepast en meestal nog niet als onderdeel van groenblauwe netwerken in de stad of in aansluiting op het ommeland. Steden zijn op zoek naar effectieve groenblauwe maatregelen die integraal bijdragen aan klimaatadaptatie, versterking van de biodiversiteit en leefbaarheid en gezondheid. Er is vooral behoefte aan kennis over praktische toepasbaarheid van maatregelen.Het onderzoek Groenblauwe stad richt zich op de vraag, welke effectieve maatregelen steden op welke wijze kunnen toepassen als onderdeel van groenblauwe netwerken in de stad en aansluitend bij het omliggende landelijke gebied. Het gaat hierbij om maatregelen die integraal bijdragen aan klimaatadaptatie, biodiversiteit, leefbaarheid en gezondheid.Uitgangspunt van het onderzoek is de al bestaande kennis rond effectiviteit en toepasbaarheid van groenblauwe maatregelen. Vanuit deze bestaande kennis kijken we wat hiervan toegepast kan worden in vijf casestudiegebieden in Nederland, door het aanbieden van concrete handelingsperspectieven. Hiervoor gebruiken we de casestudiemethode, aangevuld met effectmetingen en belevingsonderzoek. Deze nieuw opgedane kennis laten we landen in de rest van Nederland.Het tweejarig onderzoek wordt uitgevoerd door een consortium van vijf hogescholen, diverse casestudiepartners en partners die overkoepelend deelnemen aan de Learning Community. Het leren van elkaar staat centraal in het onderzoek. Om kennis uit te wisselen organiseren we een Groenblauwe Safari langs de verschillende casestudiegebieden en een slotsymposium. Het onderzoek leidt tot lessen voor de praktijk, inclusief handelingsperspectieven met praktische handvatten voor de toepassing van groenblauwe maatregelen.",,,,https://hbo-kennisbank.nl/details/aereshogeschool:oai:www.greeni.nl:VBS:2:153727
Urban Upycling : van Beleid naar Praktijk: hoe gemeentes en circulaire Initiatieven elkaar kunnen vinden?,Nederland streeft ernaar in 2050 volledig circulair te zijn waarin concrete projecten zoals de Circulaire Ambachtscentra en -netwerken een belangrijke rol spelen. Maar hoe stem je een nieuw circulair ambachtscentrum af op deze bestaande initiatieven die de gemeente al rijk is? Samen met de onderzoekers en praktijkpartners in de RAAK-PRO Urban Upcycling zijn we op zoek gegaan naar praktische voorbeelden waar afstemming een uitdaging blijkt én waar al succesvol aan integratie wordt gewerkt. Deze voorbeelden duiden we door systemisch te analyseren hoe ze zijn ontstaan. Deze praktijkpublicatie biedt daardoor waardevolle kennis over hoe de ontwikkeling van circulaire ambachtscentra en -netwerken kan bijdragen aan een lokale circulaire economie. Beleidsmakers en intermediairs kunnen hieruit lessen trekken voor het realiseren van een toekomstbestendige lokale upcycling economie. Onderdeel van project: Urban Upcycling.,,,,https://hbo-kennisbank.nl/details/sharekit_windesheim:oai:surfsharekit.nl:a67c4ce2-5a60-4cc1-9a9c-a893f89e788f
